keyword	title	content
柴胡	投稿资讯▏晋商言药：山西品种点评	最近这几天，天气还是继续下雨，这对一些低杆作物，是一种严重打击，如，生地，黄芩，柴胡几乎泡在水里，目前生地已经无法推断单产了，死苗的死苗，烂根的烂根，然而这几天一些公司厂家以及加工户好像已经反应...
柴胡	陕西宝鸡陈仓区柴胡零星产新价格坚挺走动顺畅	柴胡是耐寒、耐旱、怕涝的药用植物，在生态环境较差的地区反能显示其优势，因此柴胡在全国种植面积分布广泛。甘肃、山西和陕西是柴胡的三大种植产区，陕西省渭南市、安康市、宝鸡市、商洛市等地的柴胡种植面积...
柴胡	西北品种点评之柴胡：两极分化日趋严重	一、产地分布柴胡在全国种植面积分布广泛。甘肃、山西和陕西是柴胡的三大种植产区，甘肃省家种柴胡主产以陇西为中心的甘肃定西北部各县，定西市陇西县通渭、马河镇一带大面积种植。近年来陇南一带（礼县、宕昌县、武...
柴胡	2018汛期直击：甘肃遇最强降雨天气部分产地红色预警	据甘肃省气象局7月11日9时发布：2018年7月9～11日我省出现今年以来最强降水，陇东南最大累积雨量达200～250毫米，强降水主要集中在10日白天到夜间，陇南、天水、平凉、庆阳等市出现暴雨，局地出...
柴胡	强监管周期下，柴胡的优胜劣汰	药典是国家对药品质量标准及检验方法所作的技术规定，是药品生产、供应、使用、检验、管理部门共同遵循的法定依据。
柴胡	柴胡质量参差不齐，后市价格能否出现波澜？	柴胡是药用大宗品种，有着悠久广泛的用药历史，本品为伞形科植物柴胡或狭叶柴胡的干燥根。柴胡具有解热镇痛、抗炎镇静、
柴胡	天地网创始人龙兴超先生深入产地一线调研豫西丹参、黄芩长势情况	天地网三门峡公司地理位置优越，连翘、丹参、黄芩、柴胡这四个大品种的核心主产地均在公司周边方圆几十公里之内，龙兴超先生作为一名业界资深专家，对当地中药材品种进行了分析和指导，从战略高度对三门峡公司如何做...
柴胡	流感疫情来势汹涌，能否刺激柴胡行情再走高价？	今年冬季的流感疫情来势汹涌，让医疗机构忙得应接不暇，各大药店部分清热解毒类用药销量猛增，甚至还有缺货的现象。这也让清热解毒的中药材原料备受关注，而柴胡对普通感冒、流行性感冒、疟疾、肺炎等有较好的退热效...
柴胡	中药材大咖考察：暴涨？暴跌？甘肃药材的众生相！	党参、当归、黄芪作为甘肃药材行情的晴雨表和风向标，引领着陇西药材发展的方向。但黄芩、款冬花、甘草、旱半夏也引领全国价格风向标，近年有句话说的好，得甘肃药材得天下。近期是甘肃各种药材集中产新期，甘肃药材...
柴胡	湖北英山苍术当归和柴胡病虫害情况调研	本期，第3调研小组对凯丰农资服务有限公司、宁夏大地生态有限公司和宁夏中卫市中宁县枸杞产业发展服务局进行调研
柴胡	《药材问答》第35期：元胡、柴胡等品种近况概览	《药材问答》是一档问答形式的线上栏目。每一期，针对广大天地网用户所提出的热点问题，都会由栏目制作人及天地网智库专家及时作出回答，编写制作成集锦或深度文章。——本期焦点：元胡、柴胡近期行情概览。
柴胡	聚焦：柴胡产新，种源混乱质量堪忧！	柴胡，做为经典用药之一，在我国中医药原料来源上地位重要。张仲景就擅用柴胡，大小柴胡汤、柴葛解肌汤、柴胡龙骨牡蛎汤等无不成为后世医家推崇的千古名方；日本汉方中同样把柴胡当作常备药，从我国引进改良出“三岛...
柴胡	快讯：西北部分低价药材进入涨价通道！	据天地网陇西分公司9月11日消息：西北品种党参、当归刚刚表演完，市场平静少许日子。但近几日，其它西北地产药材又开始起势，纷纷进入小幅上涨通道，其中牛蒡子和款冬花引领涨势品种前列......
柴胡	曲永霞点评西北10大旱灾品种	2016年上半年，一场持续2个多月的旱灾袭击河西走廊。虽然期间偶有局部降雨，但由于落雨不均匀，根本无法缓解河西走廊特别是定西地区大面积的干旱。做为西北药材主产地，多个地产品种影响明显，价格纷纷...
柴胡	中药材天地网考察山西闻喜记实	山西省南部考察第四站是山西省闻喜县，9月21日下午笔者陪同中药材天地网专家委员会的三位老师：蒋尔国、贾海彬、龙银，驱车来到了闻喜县凹底镇药材专业村→辛村，并受到了天地网会员张永俊的热情接待。　　闻...
柴胡	国家严查整顿中药材行业背后	在国家严查、严打中药材流通端和终端之后，整个市场陷入前所未有的低迷之中，虽然真正原因是供大于求，但政策影响无异于雪上加霜。近期，国家各种关于中医药政策的消息和文...
柴胡	[陇西药市]甘肃陇西中药材种植尾声看药市	四月下旬，陇西产区药材种植接近尾声。受连续多雨天气的影响，土地墒情极好，药材种苗因上市量减少价格转坚，但药材因资金面偏紧和生产压力加大，却是反其道而行之，走动趋...
柴胡	当中药材偶遇检查零合格您作何感想	江湖流传着这样一句话，中医亡于药。笔者起初不信，总是抱着那种不切实际的幻想。异想天开的以为中药材自古以来都是人与大自然最完美的结合。我们向自然学习，从自然这个纯...
柴胡	[陇西药市]跨年行情中的陇西中药材	年末岁尾，消费旺季，为了应对过节期间的生产和销售，药厂、药商和加工户都要补充部分货源以备节日需求，顺便储备节后供应货源，各类药材销量有所增加，走动转畅，但价格相...
柴胡	柴胡行情难以翻江倒海	家种柴胡2004年量大烂市后，2007年价格开始大反弹，2011达到历史高价，2011年牛市结束，产新之后价格开始走下坡路，目前价格基本稳定在统货30-40...
柴胡	[陇西药市]陇西产新家种药材近期众生相	9月底10月初，陇西部分地产家种药材已经次第产新，但与往年不同的是，今年的行情却是冷冷清清、凄凄惨惨，亮点众里难寻。党参：无疑是最受商加关注的龙头品种...
柴胡	[陇西药市]八月中旬陇西药市中药材动态	八月中旬，入秋之后天气来了个180度大转弯，气温转凉阴雨增多，给药材的生产增添了联想空间。第七届药博会召开在即，各路药商将再此云集查看行情，探讨商机。淡旺季...
柴胡	高温干旱能否引发北方药材行情上升	入伏以来，受厄尔尼诺现象影响，北方各地普遍出现高温干旱，12个省份出现严重旱情，给农业生产造成严重损失，高温干旱现象使部分药材品种价格转坚走势转好，部分市场...
柴胡	[陇西药市]六月下旬陇西地产中药材品种动态	6月下旬，药市进入需求淡季，但市场相对前期运行好转，各类药材结束了跌宕起伏的波动，进入正常购销，走势转稳。地产三大品种行情转好，走势平稳。党参结...
柴胡	三月上旬陇西地产中药材品种动态及预警	三月上旬，随着天气转暖，又到了一年一度的药材种植季节，各种药材种苗开始采挖，部分种苗已经开始流通，但相关药材受库存和扩种压力影响，商家观望情绪浓厚，走势不快，价...
柴胡	[刘红卫]北方普降中到大雪对药材有利有害？	2013年9月以来，黄淮及山西、陕西南部等地降水不足50毫米，较常年同期偏少5-8成，陕西关中与东部、山西南部、河南西北部等地土壤墒情持续偏差，河南省受旱情况尤...
柴胡	元月上旬西北家种野生药材走势分析	2014年元月恰逢农历腊月，往年正是商家储备年货的旺季，各类药材也将迎来一波销售旺季，但受宏观经济形势影响，今年各类药材走势不温不火，价格涨跌不一。...
柴胡	流年似水一三一四药市回顾与展望（下）——展望篇	导言：我们总爱沉浸在美好的回忆之中，固定的思维模式让我们在过去的记忆里难以自拔，可2013年整年对于药市来说绝非黄粱美梦，那种闭着眼睛都能赚钱的傻瓜...
柴胡	清热解毒类药材旺季难迎利好	时令进入严冬，各地频发严寒冰冻天气，新型流感H10N8也闪亮登场，清热解毒类药材又迎来使用旺季，但目前市场各类药材反应平淡，走势一般，热点极少。一、西北品种...
柴胡	家种柴胡行情继续平淡	家种柴胡自2011年冲高回落以来，一直平平淡淡。今年产新之后，产地收购价格一直在24-30元之间徘徊，如此价位，与当前的物价水平相比，实属平淡。其能否或何时迎来...
柴胡	11月上旬西北野生中药材走势分析	11月上旬，西北家种药材迎来集中产新季，各类药材上市量大，走动缓慢，价格稳中有落，野生药材资源采集力度减小，刚性需求不减，价格优势明显，亮点纷呈。节菖蒲产新...
柴胡	九月陇西药市中药材回顾	9月份，第六届药博会即将召开，前来考察的各地药商药企增加，市场上人流量增加，但因产新临近和政策面影响，市场交易不见好转，大部分药材依然延续疲软走势。...
柴胡	[陇西药市]七月中旬西北地产药材动态	七月中旬，西北地区陆续进入夏收季节，由于天气炎热，降雨频繁，各类药材走动不快，价格低迷。家种药材走动不快，但价格基本平稳运行，大幅下降的品种不多。党参本...
柴胡	4月上旬陇西药市:各类药材出现高位盘整	四月上旬，各类药材出现高位盘整，由单边上升势头转为小幅回落态势，市场持货商和进货商经过一段的短兵相接，再次偃旗息鼓，观望评估。党参：市场个子110-1...
柴胡	[鲁振坤]涨价柴胡能否再升	受近期甘肃持续干旱影响，各规格柴胡价格均有不同幅度的上扬，目前亳州市场甘肃产家种一般统货(因质量不等)售价在40-55元之间，野生56-58元之间；内蒙黑柴胡6...
柴胡	H7N9禽流感来袭三天来清热解毒类中药材价格猛涨	4月2日我国发布在上海发现禽流感疫情，4月4日，江苏省相关部门公布了预防H7N9禽流感的中药处方，一些清热解毒类药材在此次禽流感疫情拉动下，市场和产地价格...
柴胡	[陇西药市]2012年陇西药市回顾与展望	2012年的陇西药市，在国家宏观经济大环境的探底回升中艰难运行，在几个当地看家品种的支撑下砥砺奋进，虽有波折，成绩喜人，虽有坎坷，前途光明。在总体运行质量和...
柴胡	柴胡行情下调之路	一、概述柴胡具有疏散退热、舒肝、升阳之功效，是我国传统常用中药材之一，其具有上千年的用药史。目前市场上流通的柴胡家种和野生资源均有，其中家种资源为主，野生资...
柴胡	家种药材产新上市，表现各不相同	11月上旬，节气已经立冬，陇西家种药材集中采挖上市，因产供销形势不同，价格呈现多样化走势，总体价格多有走高。span
柴胡	家种柴胡“财”路曲折	柴胡是药用大宗品种，随着近几年野生资源减少和采集量下降；家种资源以其含量与野生资源相当、种植管理技术简单、效益较高等优势，逐渐占据市场主导地位，其价格运行随生...
柴胡	2012年6月林州地产药材考察纪实（视频）	2012年6月申林根及当地的信息观察林州考察视频林州市是红旗渠精神的发祥地，位于河南省北部太行山东麓，地处山西、河北、河南三省交汇处。境内多山、丘陵地，独特...
柴胡	苍术降价无人采挖、金莲花将大量产新	围场满族蒙古族自治县位于河北省最北面，和内蒙古自治区交界，也是河北省占地面积最大的县。当地主产的中药材均为野生，有柴胡、黄芩、苍术、金莲花等。柴胡、黄芩经多年采...
柴胡	甘肃家种品种集体降温	四月以来甘肃产地降雨频繁，虽然雨量不大，但新种植的药材出苗有保障，天气拉动的上升行情不再，各类家种药材集体降温。柴胡:自2007年涨价之后，种植逐步恢复，去年产...
柴胡	甘肃家种品种集体降温	四月以来甘肃产地降雨频繁，虽然雨量不大，但新种植的药材出苗有保障，天气拉动的上升行情不再，各类家种药材集体降温。
柴胡	[陇西药市]文峰市场大多品种交易走缓	时下正是“五一”小长假，无论是大街或公园到处人头攒动，然而唯有药市冷冷清清，市场一片清淡，随处可见打牌、闲聊的本地经销商，外地客商更是寥...
柴胡	石家庄新乐县“31号柴胡”健康发展	31号柴胡又称石岛柴胡，主要出口日本。近年石家庄新乐县为了保证产品质量，大力发展订单种植。即从籽种、肥料、农药等关键技术环节，对种植户全部提供，且种植、管理、施...
柴胡	银柴胡生产未恢复价格仍将高位运行	谷雨已过，各地药材种植渐次落下帷幕，多数药材呈现扩种迹象，价格整体回落。小品种银柴胡则是卓尔不群，笑傲药市。原因为何？——库...
柴胡	山西万荣黄芩、柴胡近况	黄芩：黄芩近期行情较好，药农积极采挖货源，目前采挖已进入后期。近阶段一直有提取厂来此大量收购鲜品，鲜货货源成交量较大，收购价不断上涨，目前升至/span
柴胡	柴胡后市或现拐点	一、品种概述柴胡主产于山西万荣及甘肃陇西周边地区，野生、家种兼有。其不仅生长周期较长（一般为2-3年），而且单产量低，亩产约90-120公斤。二、市场走势1、...
柴胡	一场春潮后市场又低迷	经过了春节后药厂药商集中补货采购带来的人气高峰，近期市场采购商减少，各类地产药材进入正常消化，交易放缓，行情转稳，价格回落，呈现低迷走势。具体品种走势如下：党参...
柴胡	马蹄大黄将成为西北品种新亮点	马蹄大黄是甘肃四大地产中药材之一，近几年它的几个孪生兄弟纷纷亮相登场，各自步入它们的高价或天价。如当归、党参均突破百元大关，黄芪也表现不俗而创出历史高价。唯独大...
柴胡	甘肃品种——树欲静而风不止（中）	与党参、黄芪等品种的跃跃欲试相比，柴胡、甘草、大黄、款冬花的表现差强人意，是前进中的徘徊，还是下跌前的序曲？难解也难分。柴胡：家种货源自2004年丰产烂市...
柴胡	用季来临黄芩再次走畅	今年入冬以来，北方地区冷空气活动频繁，各地流感高发，药厂、药商均加大采购储备力度，推动黄芩再次走畅价升。目前，陇西产地个子18元，切片20元，鲜货7元，商家收...
柴胡	用季来临黄芩再次走畅	今年入冬以来，北方地区冷空气活动频繁，各地流感高发，药厂、药商均加大采购储备力度，推动黄芩再次走畅价升。目前，陇西产地个子spanlan
柴胡	家种柴胡或面临拐点	家种柴胡自去年进入高点之后，交易量呈现萎缩之势，市场货源消化不佳，今年后半年以来更是价格疲软，持货商经历持久战，心态渐渐浮躁，出售意愿强烈。去年同期还信誓旦旦...
柴胡	[鲁振坤]银柴胡行情仍将继续看好	又到银柴胡产新时，今年虽然好多品种产新走迟价滑，而银柴胡却变现不俗，行情非但没有下滑，反而稳中攀升，鲜品交易价由产新初期的18元左右上升为目前的19-20元。...
柴胡	柴胡后市浅析	一、柴胡简介柴胡为伞形科植物柴胡或狭叶柴胡的干燥根，春秋二季采挖，属清虚热中药，用于感冒发热、寒热往来、疟疾、肝郁气滞等症。其市场年需求量在5000吨左右...
柴胡	[陇西药市]甘肃文峰市场各品种走缓、价低	进入8月中旬到9月份以来甘肃基本都是阴雨天，昨日小到中雨今日又降中雨，气温下降至8-11度，这也应验了一句古话“一场秋雨一场凉十场秋雨棉衣上&rdq...
柴胡	张家口宣化苍术基本清仓柴胡货少	张家口宣化苍术基本清仓柴胡货少pclass="p0"style="MARGIN-TOP:0pt;
柴胡	[刘红卫]柴胡后势分析	柴胡行情自2007年冲高，2008年短暂回落，2009年再次冲高之后，就一直在高位盘整，并稳步攀升。现山西产地选装柴胡价80-85元，统装66-68元，产地大...
柴胡	2011年7月甘肃地产品种走势分析	开始进入伏天的7月，气温一天高于一天。药市相对却真正进入淡季，市场略显冷清。在国家严控通涨和药厂投料因高温停止进货的大背景下，各品种交易大都有所放缓，价位基本保...
柴胡	[陇西药市]7月份甘肃地产品种分析	7月份开始进入伏天天气温一天高于一天。相对药市却真正进入淡季，市场略显冷清。在国家严控通涨和药厂投料因气温高药厂停止进货的大背景下各品种交易量大都有所放缓，...
柴胡	[陇西药市]7月份甘肃地产品种分析	7月份开始进入伏天天气温一天高于一天。相对药市却真正进入淡季，市场略显冷清。在国家严控通涨的大背景下各品种交易大都放缓，价位保持基本稳定。党参在前半年因本...
